{
  "$schema": "https://json-schema.org/draft/2020-12/schema",
  "title": "package.json (subset)",
  "type": "object",
  "required": [
    "name",
    "version"
  ],
  "properties": {
    "name": {
      "type": "string",
      "maxLength": 214,
      "pattern": "^(?:@[a-z0-9-~][a-z0-9-._~]*/)?[a-z0-9-~][a-z0-9-._~]*$"
    },
    "version": {
      "type": "string",
      "pattern": "^(0|[1-9]\\d*)\\.(0|[1-9]\\d*)\\.(0|[1-9]\\d*)(?:-[0-9A-Za-z.-]+)?(?:\\+[0-9A-Za-z.-]+)?$"
    },
    "private": {
      "type": "boolean"
    },
    "keywords": {
      "type": "array",
      "items": {
        "type": "string"
      },
      "uniqueItems": true
    },
    "license": {
      "anyOf": [
        {
          "type": "string",
          "enum": [
            "MIT",
            "ISC",
            "Apache-2.0",
            "BSD-3-Clause",
            "UNLICENSED"
          ]
        },
        {
          "type": "string",
          "pattern": "^SEE LICEN[CS]E IN "
        },
        {
          "type": "object",
          "required": [
            "type"
          ],
          "properties": {
            "type": {
              "type": "string"
            }
          }
        }
      ]
    },
    "bin": {
      "oneOf": [
        {
          "type": "string"
        },
        {
          "type": "object",
          "additionalProperties": {
            "type": "string"
          },
          "minProperties": 1
        }
      ]
    },
    "scripts": {
      "type": "object",
      "additionalProperties": {
        "type": "string"
      }
    },
    "dependencies": {
      "$ref": "#/$defs/deps"
    },
    "devDependencies": {
      "$ref": "#/$defs/deps"
    },
    "engines": {
      "type": "object",
      "properties": {
        "node": {
          "type": "string"
        }
      },
      "maxProperties": 3
    },
    "files": {
      "type": "array",
      "items": {
        "type": "string"
      },
      "minItems": 1
    }
  },
  "$defs": {
    "deps": {
      "type": "object",
      "patternProperties": {
        "^(@[a-z0-9-~][a-z0-9-._~]*/)?[a-z0-9-~][a-z0-9-._~]*$": {
          "type": "string"
        }
      },
      "additionalProperties": false
    }
  }
}
