{
  "name": "@acme/log-shipper",
  "version": "2.10.0-rc.1+build.7",
  "private": true,
  "keywords": ["logs", "shipper", "vector"],
  "license": "Apache-2.0",
  "bin": {"shipper": "bin/shipper.js"},
  "scripts": {"test": "node --test", "build": "tsc -p ."},
  "dependencies": {"undici": "^6.19.2", "@acme/core": "workspace:*"},
  "engines": {"node": ">=20"},
  "files": ["dist", "bin"]
}
